イオンモール奈良登美ヶ丘店,〒630-0115,奈良県生駒市鹿畑町3027番地,TEL:0743-70-0001
ドン・キホーテ奈良店,〒630-8031,奈良県奈良市柏木町480-1,TEL:0742-30-5211
ドン・キホーテ天理店,〒632-0071,奈良県天理市田井庄町470番１,TEL:0743-69-4311
MEGAドン・キホーテ 桜井店,〒633-0067,奈良県桜井市大字大福1039-1,TEL:0744-44-2711
イオンモール橿原店,〒634-0837,奈良県橿原市曲川町7丁目20番1号,TEL:0744-21-2111
キリン堂高田新庄店,〒635-0054,奈良県大和高田市曽大根196,TEL:0745-25-2660
MEGAドン・キホーテUNY 西大和店,〒639-0218,奈良県北葛城郡上牧町ささゆり台一丁目1番1号,TEL:0745-77-6511
ドン・キホーテ香芝インター店,〒639-0265,奈良県香芝市上中156-1,TEL:0745-71-3011
アピタ大和郡山店,〒639-1028,奈良県大和郡山市田中町517番,TEL:0743-54-2711
