アピタ富山東店,〒930-0835,富山県富山市上冨居3-8-38,TEL:076-452-3311
ドン・キホーテ高岡店,〒933-0321,富山県高岡市六家1276-2,TEL:0766-31-6311
イオン高岡南店,〒933-0813,富山県高岡市下伏間江383,TEL:0766-32-1111
MEGAドン・キホーテUNY 魚津店,〒937-0851,富山県魚津市住吉 600番地,TEL:0765-23-4111
ドン・キホーテ 射水店,〒939-0285 ,富山県射水市本開発 地区土地区画整理 事業施工地区内9街区1番,TEL:0570-032-721
イオンスタイルとなみ,〒939-1344,富山県砺波市中神一丁目174,TEL:0763-32-8800
MEGAドン・キホーテUNY 砺波店,〒939-1363,富山県砺波市太郎丸3丁目69番地,TEL:0763-32-7711
ZAKKA＆COSME じゅんTONAMI,〒939-1364,富山県砺波市豊町1丁目16-14,TEL:0763-32-1726
HIROCON富山ファボーレ店,〒939-2716,富山県富山市婦中町下轡田165-1ファボーレ本館2階,TEL:076-461-7277
ドン・キホーテ富山店,〒939-8212,富山県富山市掛尾町365-1,TEL:076-424-0711
